{
  "schemaVersion": 1,
  "projectId": "6ac090a4-3656-4d83-8eb6-2891508196d5",
  "teamId": "ghostex-core",
  "roleId": "web-ui",
  "visibility": "role:reviewer",
  "audience": ["lead"],
  "kind": "gotcha",
  "stage": "execute",
  "paths": ["web/src/session/store.ts"],
  "author": { "harness": "claude-code", "agentId": "afbeffc8057c3e6bd", "agentType": "web-ui", "sessionId": "733a99fd-b357-4127-87d1-0c794fcde506" },
  "importance": 0.7,
  "contentHash": "2c26b46b68ffc68ff99b453c1d30413413422d706483bfa0f98a5e886266e7ae",
  "ts": "2026-10-04T00:40:00Z"
}
